{
  "$schema": "http://json-schema.org/draft-06/schema#",
  "title": "Quiz",
  "type": "object",
  "properties": {
    "groups": {
      "type": "object",
      "description": "Groups of questions ids separated by type",
      "additionalProperties": {
        "type": "array",
        "items": {
          "type": "integer"
        }
      },
      "uniqueProperties": true,
      "minProperties": 1
    },
    "questions": {
      "description": "List of questions with id and content",
      "type": "array",
      "items": {
        "properties" : {
          "id": {
            "type": "string"
          },
          "content": {
            "type": "string"
          }
        },
        "required": ["id", "content"]
      },
      "uniqueItems": true,
      "minItems": 1
    },
    "summary": {
      "description": "List of possible quiz result groups",
      "type": "object",
      "additionalProperties": {
        "properties" : {
          "longName": {
            "type": "string"
          },
          "rule": {
            "type": "string"
          }
        },
        "required": ["rule"]
      },
      "uniqueItems": true,
      "minItems": 1
    },
    "choices": {
      "description": "Optional list of possible question choices",
      "type": "array",
      "minItems": 1,
      "items": {
        "properties": {
          "value": {
            "type": "integer"
          },
          "content": {
            "type": "string"
          }
        },
        "required": ["value", "content"]
      },
      "uniqueItems": true
    }
  },
  "required": ["summary", "questions", "groups"]
}
